{
  "schema_version": "1.0.0",
  "library": "transloco",
  "platform": "angular",
  "packages": ["@jsverse/transloco"],
  "install": {
    "method": "official-schematic",
    "command": {
      "executable": "nx",
      "argv": ["g", "@jsverse/transloco:ng-add", "--project", "{{app}}"]
    },
    "notes": "i18n par défaut de toute app Angular du workspace (ADR-0036). L'exécuteur (add-library, lot B) installe d'abord le paquet, puis lance ce schematic avec `{{app}}` = nom du projet Nx. Le schematic câble `provideTransloco()`, un loader HTTP et l'arborescence i18n. Le renderer de shell l'écrit déjà ; cette recette garde-fou sa dérive. Absence de TRANSLATION_PORT / provideI18n : prouvée par compilation (runtime_acceptance), pas par un scan textuel — un commentaire de migration s'y ferait piéger."
  },
  "static_invariants": [
    {
      "id": "provider",
      "description": "provideTransloco() est au bootstrap",
      "footprint": true,
      "assert": {
        "file": "src/app/app.config.ts",
        "kind": "file-contains",
        "value": "provideTransloco"
      }
    },
    {
      "id": "http-loader",
      "description": "un loader Transloco existe",
      "assert": {
        "file": "src/app/transloco-loader.ts",
        "kind": "file-contains",
        "value": "TranslocoLoader"
      }
    }
  ],
  "runtime_acceptance": [
    {
      "id": "key-renders-translation",
      "description": "un composant qui utilise le pipe `transloco` / `TranslocoDirective` compile sous ngc --strictTemplates dans une app candidate isolée, ne référence que Transloco, et rend la traduction d'une clé (pas la clé brute) monté avec TranslocoTestingModule",
      "proof": "compile-component",
      "status": "enforced"
    },
    {
      "id": "offline-production-build",
      "description": "la build de production complète réussit dans le candidat sans accès réseau",
      "proof": "production-build",
      "status": "enforced"
    }
  ],
  "guidance": "https://jsverse.gitbook.io/transloco"
}
