{
  "schema_version": "1.0.0",
  "library": "angular-material",
  "platform": "angular",
  "packages": ["@angular/material", "@angular/cdk"],
  "install": {
    "method": "official-schematic",
    "command": {
      "executable": "nx",
      "argv": [
        "g",
        "@angular/material:ng-add-setup-project",
        "--project",
        "{{app}}",
        "--theme",
        "azure-blue",
        "--skip-confirmation"
      ]
    },
    "normalizations": [
      {
        "kind": "exact-replacement",
        "file": "src/index.html",
        "search": "<link rel=\"preconnect\" href=\"https://fonts.googleapis.com\">",
        "replacement": "",
        "occurrences": 1
      },
      {
        "kind": "exact-replacement",
        "file": "src/index.html",
        "search": "<link rel=\"preconnect\" href=\"https://fonts.gstatic.com\" crossorigin>",
        "replacement": "",
        "occurrences": 1
      },
      {
        "kind": "exact-replacement",
        "file": "src/index.html",
        "search": "<link href=\"https://fonts.googleapis.com/css2?family=Roboto:wght@300;400;500&display=swap\" rel=\"stylesheet\">",
        "replacement": "",
        "occurrences": 1
      },
      {
        "kind": "exact-replacement",
        "file": "src/index.html",
        "search": "<link href=\"https://fonts.googleapis.com/icon?family=Material+Symbols+Outlined\" rel=\"stylesheet\">",
        "replacement": "",
        "occurrences": 1
      },
      {
        "kind": "exact-replacement",
        "file": "src/styles.scss",
        "search": "typography: Roboto,",
        "replacement": "typography: (plain-family: system-ui, brand-family: system-ui),",
        "occurrences": 1
      },
      {
        "kind": "exact-replacement",
        "file": "src/styles.scss",
        "search": "  font: var(--mat-sys-body-medium);",
        "replacement": "",
        "occurrences": 1
      }
    ],
    "notes": "Entrée setup-only fournie par le paquet Angular Material 22.2.1 et liée à cette piste exacte. Le point d'entrée public `ng-add` est volontairement interdit ici : il planifie toujours un NodePackageInstallTask, alors que les dépendances sont déjà épinglées, installées et vérifiées par le protocole gouverné. L'exécution se fait sans PATH : une tâche implicite ne peut résoudre aucun gestionnaire de paquets par son nom. Le schematic reçoit `{{app}}` = nom du projet Nx cible. Material 22.2.1 injecte encore les polices Google Roboto et Material Symbols Outlined ainsi que `typography: Roboto`; les normalisations exactes retirent ces dépendances réseau et sélectionnent les polices système. Le raccourci global `font: var(--mat-sys-body-medium)` est aussi retiré : Material possède l'apparence de ses composants, pas la typographie hôte décidée par l'application et Tailwind (ADR-0041). Les autres déclarations globales du bloc vendeur (`color-scheme`, couleurs, marge et hauteur) restent des effets connus ; aucune régression qui justifierait leur retrait n'est établie. Toute dérive de la sortie du vendeur fait échouer la recette. Le build de production hors réseau et l'acceptance navigateur de préservation typographique en apportent les preuves fonctionnelles."
  },
  "static_invariants": [
    {
      "id": "m3-theme",
      "description": "un thème M3 est défini dans les styles globaux via mat.theme()",
      "footprint": true,
      "assert": {
        "file": "src/styles.scss",
        "kind": "file-matches",
        "value": "mat\\.theme\\("
      }
    }
  ],
  "runtime_acceptance": [
    {
      "id": "material-component-compiles",
      "description": "dans un workspace candidat autonome : un composant standalone important un composant Material représentatif (ex. MatButton) compile sous ngc --strictTemplates en import standalone (jamais un NgModule agrégateur). Preuve de compilation uniquement — le rendu DOM et le comportement d'animation sont des critères distincts (browser-coexistence + preuve dédiée, à définir).",
      "proof": "compile-component",
      "status": "enforced"
    },
    {
      "id": "material-preserves-host-typography",
      "description": "dans un workspace candidat autonome : le CSS réellement compilé est chargé par le moteur Chromium épinglé après une typographie hôte sentinelle ; les valeurs calculées de font-family, font-size, line-height et font-weight restent inchangées sur la racine html, le body et un enfant qui en hérite. Cette preuve interdit qu'un thème Material impose silencieusement sa typographie globale à l'application.",
      "proof": "browser-style-preservation",
      "status": "enforced"
    },
    {
      "id": "offline-production-build",
      "description": "la build de production complète réussit dans le candidat sans accès réseau ; aucune police, feuille de style ou ressource distante ajoutée par le schematic ne peut être requise à la compilation",
      "proof": "production-build",
      "status": "enforced"
    }
  ],
  "coexistence": [
    {
      "with": "tailwind",
      "intent": "Material possède l'apparence des composants ; Tailwind possède la mise en page et l'espacement. Le preflight Tailwind ne doit jamais réinitialiser un composant Material — garanti mécaniquement par la relation de couche : le preflight est confiné dans @layer, Material émet ses jetons hors couche, et une couche perd toujours contre du CSS hors couche. Corollaire assumé : une utilitaire Tailwind ne surcharge pas non plus un composant Material ; il faut du CSS applicatif hors couche pour cela.",
      "runtime_acceptance": [
        {
          "id": "material-tailwind-cascade-order",
          "description": "sur le CSS réellement compilé de l'app : les jetons de design `--mat-*` émis par mat.theme() sont hors couche et le preflight Tailwind est confiné dans @layer. Une couche perd toujours contre du CSS hors couche, donc le reset ne peut effacer ni les jetons ni les composants qui les lisent, quelle que soit la spécificité. À l'installation le bundle ne contient encore aucune règle .mat-* (aucun composant Material utilisé) : cette preuve porte sur la relation de cascade, pas sur un rendu — la mise en page, la peinture et les états focus restent couverts par l'acceptance navigateur.",
          "proof": "compiled-css-rule",
          "status": "enforced"
        },
        {
          "id": "material-tailwind-render-together",
          "description": "dans le candidat isolé, un moteur Chromium épinglé par empreinte (politique de résolution) charge le CSS RÉELLEMENT compilé de l'app et rend une page portant un bouton et une utilitaire Tailwind. Le moteur — et non une lecture du texte CSS — confirme trois faits calculés : les jetons --mat-* se résolvent sur <html>, une règle hors couche n'est PAS écrasée par le preflight Tailwind, et une utilitaire Tailwind produit toujours sa couleur. Aucun accès réseau : le résultat est extrait par --dump-dom, sans CDP ni socket.",
          "proof": "browser-coexistence",
          "status": "enforced"
        }
      ]
    }
  ],
  "guidance": "https://material.angular.dev/guide/theming"
}
